{
  "source_file_id": "sf_01HABCDEF123456789",
  "upload_id": "upload_01HABCDEF123456789",
  "tenant_id": "tenant_acme",
  "collection_id": "col_default",
  "filename": "annual_report_2025.pdf",
  "mime_type": "application/pdf",
  "size_bytes": 2457600,
  "state": "READY",
  "intake_job_id": "job_01HABCDEF123456789",
  "scan_verdict": "clean",
  "created_at": "2026-05-27T10:00:00Z",
  "updated_at": "2026-05-27T10:05:00Z"
}
